{
  "schema_version": "medioevo.forge_project_spec.v0.1",
  "project_id": "forge-preview-synthetic-001",
  "source_system": "MEDIOEVO_FORGE_APP_GAME_CREATOR",
  "target_system": "DUAT_SIMULATOR_WORLD",
  "integration_mode": "preview_only",
  "mutates_systems": [],
  "preview_contract": { "emits": "ScenarioSpec", "preview_only": true },
  "public_safe": true,
  "action_gate": { "decision": "REVIEW", "reason": "preview_contract_only" },
  "boundary": { "publication_gate": "BLOCK", "contains_private_data": false, "public_safe": true }
}

